{
  "schemaVersion": "1.0.0",
  "kind": "catalog",
  "generatedAt": "2026-05-23T06:16:23.584Z",
  "summary": {
    "primitiveCount": 4,
    "recipeCount": 2,
    "conceptCount": 1,
    "ruleFileCount": 1
  },
  "primitives": [
    {
      "id": "analytics",
      "category": "telemetry",
      "maturity": "stable",
      "package": "@latimer-woods-tech/analytics",
      "summary": "Behavioral and operational event capture substrate for Factory services.",
      "provides": [
        "event-tracking",
        "funnel-signals",
        "service-telemetry"
      ],
      "recommendedWith": [
        "crm",
        "telephony"
      ]
    },
    {
      "id": "compliance",
      "category": "governance",
      "maturity": "stable",
      "package": "@latimer-woods-tech/compliance",
      "summary": "Consent, audit, and policy enforcement substrate for regulated or operator-sensitive workflows.",
      "provides": [
        "audit-log",
        "consent-recording",
        "policy-check-hooks"
      ],
      "recommendedWith": [
        "telephony",
        "crm"
      ]
    },
    {
      "id": "crm",
      "category": "customer-data",
      "maturity": "stable",
      "package": "@latimer-woods-tech/crm",
      "summary": "Lead, contact, and customer workflow substrate backed by Neon and analytics-aware data flows.",
      "provides": [
        "contact-store",
        "lead-workflows",
        "customer-state",
        "campaign-targeting-input"
      ],
      "recommendedWith": [
        "analytics",
        "compliance"
      ]
    },
    {
      "id": "telephony",
      "category": "communications",
      "maturity": "stable",
      "package": "@latimer-woods-tech/telephony",
      "summary": "Voice and telephony substrate for Telnyx, Deepgram, ElevenLabs, and LLM-mediated voice sessions.",
      "provides": [
        "voice-session",
        "telnyx-webhook-verification",
        "speech-to-text",
        "text-to-speech",
        "calling-hours-policy"
      ],
      "recommendedWith": [
        "compliance",
        "crm",
        "analytics"
      ]
    }
  ],
  "recipes": [
    {
      "id": "outbound-dialer",
      "maturity": "experimental",
      "summary": "Outbound call-bank service pattern for compliant campaign dialing and disposition capture.",
      "goal": "Provision a staging-first outbound calling service with lead targeting, consent-aware controls, and delivery telemetry.",
      "primitives": [
        "telephony",
        "crm",
        "compliance",
        "analytics"
      ],
      "optionalPrimitives": [],
      "expectedSurfaces": [
        "/health",
        "/manifest",
        "/api/campaigns",
        "/api/campaigns/:id/start",
        "/api/dispositions"
      ],
      "smokeChecks": [
        {
          "path": "/health",
          "expectedStatus": 200,
          "expectContains": "status"
        },
        {
          "path": "/manifest",
          "expectedStatus": 200,
          "expectContains": "manifestVersion"
        }
      ]
    },
    {
      "id": "outbound-dialer-importer",
      "maturity": "experimental",
      "summary": "Outbound dialer service pattern optimized for imported lead lists and operator-managed targeting.",
      "goal": "Provision a staging-first outbound calling service for CSV-imported audiences with consent-aware controls and delivery telemetry.",
      "primitives": [
        "telephony",
        "compliance",
        "analytics"
      ],
      "optionalPrimitives": [],
      "expectedSurfaces": [
        "/health",
        "/manifest",
        "/api/imports",
        "/api/imports/:id/start",
        "/api/dispositions"
      ],
      "smokeChecks": [
        {
          "path": "/health",
          "expectedStatus": 200,
          "expectContains": "status"
        },
        {
          "path": "/manifest",
          "expectedStatus": 200,
          "expectContains": "manifestVersion"
        }
      ]
    }
  ],
  "concepts": [
    {
      "id": "outbound-dialer-campaign",
      "displayName": "Outbound Dialer Campaign Service",
      "summary": "Governed menu entry for a consent-aware outbound dialing service with CRM targeting and delivery telemetry.",
      "status": "approved",
      "maturity": "experimental",
      "tags": [
        "telephony",
        "campaigns",
        "outbound"
      ],
      "menuVisible": true,
      "approvalTier": "council-reviewed",
      "parameters": [
        {
          "id": "campaignSource",
          "type": "string",
          "description": "Primary source for campaign audience selection.",
          "required": true,
          "enum": [
            "csv-import",
            "crm-segment",
            "api-trigger"
          ],
          "default": null,
          "formatHint": null
        },
        {
          "id": "enableVoiceSynthesis",
          "type": "boolean",
          "description": "Whether AI voice generation is included in the first release slice.",
          "required": false,
          "enum": [],
          "default": true,
          "formatHint": null
        },
        {
          "id": "workerDomain",
          "type": "string",
          "description": "Branded hostname used for the deployed worker and smoke-check URLs.",
          "required": true,
          "enum": [],
          "default": null,
          "formatHint": "hostname"
        }
      ],
      "recipeSelection": {
        "defaultRecipeId": "outbound-dialer",
        "rules": [
          {
            "id": "csv-import-uses-importer",
            "recipeId": "outbound-dialer-importer",
            "matchAll": [
              {
                "parameter": "campaignSource",
                "equals": "csv-import"
              }
            ]
          },
          {
            "id": "crm-segment-uses-crm-dialer",
            "recipeId": "outbound-dialer",
            "matchAll": [
              {
                "parameter": "campaignSource",
                "equals": "crm-segment"
              }
            ]
          },
          {
            "id": "api-trigger-uses-crm-dialer",
            "recipeId": "outbound-dialer",
            "matchAll": [
              {
                "parameter": "campaignSource",
                "equals": "api-trigger"
              }
            ]
          }
        ]
      },
      "recipes": [
        {
          "id": "outbound-dialer",
          "summary": "Outbound call-bank service pattern for compliant campaign dialing and disposition capture.",
          "maturity": "experimental",
          "primitives": [
            "telephony",
            "crm",
            "compliance",
            "analytics"
          ],
          "optionalPrimitives": []
        },
        {
          "id": "outbound-dialer-importer",
          "summary": "Outbound dialer service pattern optimized for imported lead lists and operator-managed targeting.",
          "maturity": "experimental",
          "primitives": [
            "telephony",
            "compliance",
            "analytics"
          ],
          "optionalPrimitives": []
        }
      ],
      "sourcePrimitives": [
        "analytics",
        "compliance",
        "crm",
        "telephony"
      ],
      "qualification": {
        "menuVisible": true,
        "approvalTier": "council-reviewed",
        "requiredCapabilities": [
          "telephony",
          "crm",
          "compliance"
        ],
        "disallowedEnvironments": [
          "production-direct-bootstrap"
        ]
      }
    }
  ],
  "rules": [
    {
      "id": "outbound-telephony-requires-compliance",
      "description": "Any recipe that includes telephony in an outbound-sensitive context must also include compliance.",
      "ifAllPrimitives": [
        "telephony"
      ],
      "thenRequirePrimitives": [
        "compliance"
      ]
    }
  ]
}
